{
  "id": "rtx5090-full-stack",
  "name": "RTX 5090 Full Stack",
  "gpu": "rtx-5090",
  "services": [
    {
      "model": "unsloth/glm47-flash-gguf",
      "role": "llm",
      "port": 8000,
      "overrides": { "contextLength": 150000, "gpuLayers": "44" }
    },
    {
      "model": "liquidai/lfm25-audio",
      "role": "audio",
      "port": 8001
    },
    {
      "model": "disty0/flux2-klein-sdnq",
      "role": "image",
      "port": 8002
    }
  ],
  "webProxy": true,
  "vramTotal": 28500,
  "status": "stable"
}
